{
  "result_id": "rde-fixture-1",
  "contract_id": "tc-fixture-1",
  "classification": "preserved",
  "resonance_score": 1.0,
  "preservation_score": 1.0,
  "authorization_score": 1.0,
  "risk_level": "low",
  "violated_constraints": [],
  "suspicious_elements": [],
  "required_action": "approve",
  "explanation": "fixture",
  "created_at": "2026-01-01T00:00:00+00:00"
}
